{
  "protocol_version": "0.1",
  "consultation_id": "fixture-retry-policy",
  "result_id": "fixture-result-001",
  "request_revision": 1,
  "status": "need_more_context",
  "risks": [
    "A retry recommendation without the remote service's rate-limit signal could overfit one synthetic failure."
  ],
  "requested_context": [
    {
      "key": "remote_rate_limit_signal",
      "reason": "The retry policy should account for whether the remote service communicates a retry delay or only a generic rate-limit failure.",
      "max_bytes": 2048
    }
  ],
  "provenance": {
    "expert": {
      "adapter": "synthetic-fixture"
    },
    "trace_id": "fixture-trace-001",
    "created_at": "2026-09-28T00:00:01Z"
  }
}
